reg_number,url,law,purchase_method,status,object_name,customer_name,customer_url,initial_price,region_code,region_name,scraped_at
0338300031326000003,https://zakupki.gov.ru/epz/order/notice/ea20/view/common-info.html?regNumber=0338300031326000003,44-ФЗ,44-ФЗ                                    Электронный аукцион,Подача заявок,Поставка товаров для нужд МБУ ДО «ДЮЦ «Юность»,"МУНИЦИПАЛЬНОЕ БЮДЖЕТНОЕ УЧРЕЖДЕНИЕ ДОПОЛНИТЕЛЬНОГО ОБРАЗОВАНИЯ ""ДЕТСКО-ЮНОШЕСКИЙ ЦЕНТР ""ЮНОСТЬ""",https://zakupki.gov.ru/epz/organization/view/info.html?organizationId=769274,191800.0,54,Новосибирская область,2026-04-25T20:04:22.325083
0338300031326000002,https://zakupki.gov.ru/epz/order/notice/ea20/view/common-info.html?regNumber=0338300031326000002,44-ФЗ,44-ФЗ                                    Электронный аукцион,Подача заявок,Поставка товаров для нужд МБУ ДО «ДЮЦ «Юность»,"МУНИЦИПАЛЬНОЕ БЮДЖЕТНОЕ УЧРЕЖДЕНИЕ ДОПОЛНИТЕЛЬНОГО ОБРАЗОВАНИЯ ""ДЕТСКО-ЮНОШЕСКИЙ ЦЕНТР ""ЮНОСТЬ""",https://zakupki.gov.ru/epz/organization/view/info.html?organizationId=769274,300200.0,54,Новосибирская область,2026-04-25T20:04:22.326099
1038600000326000004,https://zakupki.gov.ru/epz/order/notice/ea20/view/common-info.html?regNumber=1038600000326000004,44-ФЗ,44-ФЗ                                    Электронный аукцион,Подача заявок,Поставка компьютерной техники для нужд МКУ ЦБО и МТО,"МУНИЦИПАЛЬНОЕ КАЗЁННОЕ УЧРЕЖДЕНИЕ ""ЦЕНТР БУХГАЛТЕРСКОГО ОБСЛУЖИВАНИЯ И МАТЕРИАЛЬНО-ТЕХНИЧЕСКОГО ОБЕСПЕЧЕНИЯ""",https://zakupki.gov.ru/epz/organization/view/info.html?organizationId=2187536,887700.0,54,Новосибирская область,2026-04-25T20:04:22.327029
0338300007826000099,https://zakupki.gov.ru/epz/order/notice/ea20/view/common-info.html?regNumber=0338300007826000099,44-ФЗ,44-ФЗ                                    Электронный аукцион,Подача заявок,"Поставка расходного материала для аппарата ""ФОТЕК""","ГОСУДАРСТВЕННОЕ БЮДЖЕТНОЕ УЧРЕЖДЕНИЕ ЗДРАВООХРАНЕНИЯ ""КАМЧАТСКИЙ КРАЕВОЙ РОДИЛЬНЫЙ ДОМ""",https://zakupki.gov.ru/epz/organization/view/info.html?organizationId=727069,1061645.99,54,Новосибирская область,2026-04-25T20:04:22.328338
0338300007826000088,https://zakupki.gov.ru/epz/order/notice/ea20/view/common-info.html?regNumber=0338300007826000088,44-ФЗ,44-ФЗ                                    Электронный аукцион,Подача заявок,Поставка расходных материалов для медицинских мониторов,"ГОСУДАРСТВЕННОЕ БЮДЖЕТНОЕ УЧРЕЖДЕНИЕ ЗДРАВООХРАНЕНИЯ ""КАМЧАТСКИЙ КРАЕВОЙ РОДИЛЬНЫЙ ДОМ""",https://zakupki.gov.ru/epz/organization/view/info.html?organizationId=727069,857980.58,54,Новосибирская область,2026-04-25T20:04:22.329375
0338300007826000090,https://zakupki.gov.ru/epz/order/notice/ea20/view/common-info.html?regNumber=0338300007826000090,44-ФЗ,44-ФЗ                                    Электронный аукцион,Подача заявок,Поставка расходных материалов для медицинских мониторов,"ГОСУДАРСТВЕННОЕ БЮДЖЕТНОЕ УЧРЕЖДЕНИЕ ЗДРАВООХРАНЕНИЯ ""КАМЧАТСКИЙ КРАЕВОЙ РОДИЛЬНЫЙ ДОМ""",https://zakupki.gov.ru/epz/organization/view/info.html?organizationId=727069,902712.8,54,Новосибирская область,2026-04-25T20:04:22.330771
0391600003226000056,https://zakupki.gov.ru/epz/order/notice/ea20/view/common-info.html?regNumber=0391600003226000056,44-ФЗ,44-ФЗ                                    Электронный аукцион,Подача заявок,Битум нефтяной дорожный БНД 100/130,"МУНИЦИПАЛЬНОЕ БЮДЖЕТНОЕ УЧРЕЖДЕНИЕ ГОРОДСКОГО ОКРУГА ""ГОРОД ЧИТА"" ""ДОРОЖНО-МОСТОВОЕ РЕМОНТНО-СТРОИТЕЛЬНОЕ УПРАВЛЕНИЕ""",https://zakupki.gov.ru/epz/organization/view/info.html?organizationId=2615998,7225832.85,54,Новосибирская область,2026-04-25T20:04:22.331627
0338300007826000093,https://zakupki.gov.ru/epz/order/notice/ea20/view/common-info.html?regNumber=0338300007826000093,44-ФЗ,44-ФЗ                                    Электронный аукцион,Подача заявок,Поставка расходных материалов для медицинских мониторов,"ГОСУДАРСТВЕННОЕ БЮДЖЕТНОЕ УЧРЕЖДЕНИЕ ЗДРАВООХРАНЕНИЯ ""КАМЧАТСКИЙ КРАЕВОЙ РОДИЛЬНЫЙ ДОМ""",https://zakupki.gov.ru/epz/organization/view/info.html?organizationId=727069,261625.0,54,Новосибирская область,2026-04-25T20:04:22.332438
0391600003226000055,https://zakupki.gov.ru/epz/order/notice/zk20/view/common-info.html?regNumber=0391600003226000055,44-ФЗ,44-ФЗ                                    Запрос котировок в электронной форме,Подача заявок,Автошампунь для бесконтактной мойки автомобилей,"МУНИЦИПАЛЬНОЕ БЮДЖЕТНОЕ УЧРЕЖДЕНИЕ ГОРОДСКОГО ОКРУГА ""ГОРОД ЧИТА"" ""ДОРОЖНО-МОСТОВОЕ РЕМОНТНО-СТРОИТЕЛЬНОЕ УПРАВЛЕНИЕ""",https://zakupki.gov.ru/epz/organization/view/info.html?organizationId=2615998,85681.8,54,Новосибирская область,2026-04-25T20:04:22.333242
0391600003226000054,https://zakupki.gov.ru/epz/order/notice/zk20/view/common-info.html?regNumber=0391600003226000054,44-ФЗ,44-ФЗ                                    Запрос котировок в электронной форме,Подача заявок,Печное топливо,"МУНИЦИПАЛЬНОЕ БЮДЖЕТНОЕ УЧРЕЖДЕНИЕ ГОРОДСКОГО ОКРУГА ""ГОРОД ЧИТА"" ""ДОРОЖНО-МОСТОВОЕ РЕМОНТНО-СТРОИТЕЛЬНОЕ УПРАВЛЕНИЕ""",https://zakupki.gov.ru/epz/organization/view/info.html?organizationId=2615998,2575286.51,54,Новосибирская область,2026-04-25T20:04:22.334045
0320300059726000063,https://zakupki.gov.ru/epz/order/notice/ea20/view/common-info.html?regNumber=0320300059726000063,44-ФЗ,44-ФЗ                                    Электронный аукцион,Подача заявок,"Маска лицевая аэрозольная, реверсивная","КРАЕВОЕ ГОСУДАРСТВЕННОЕ БЮДЖЕТНОЕ УЧРЕЖДЕНИЕ ЗДРАВООХРАНЕНИЯ ""ЧЕРНИГОВСКАЯ ЦЕНТРАЛЬНАЯ РАЙОННАЯ БОЛЬНИЦА""",https://zakupki.gov.ru/epz/organization/view/info.html?organizationId=716666,48654.0,54,Новосибирская область,2026-04-25T20:04:25.056546
0391600003226000048,https://zakupki.gov.ru/epz/order/notice/zk20/view/common-info.html?regNumber=0391600003226000048,44-ФЗ,44-ФЗ                                    Запрос котировок в электронной форме,Определение поставщика завершено,Автомобильные специальные масла и жидкости,"МУНИЦИПАЛЬНОЕ БЮДЖЕТНОЕ УЧРЕЖДЕНИЕ ГОРОДСКОГО ОКРУГА ""ГОРОД ЧИТА"" ""ДОРОЖНО-МОСТОВОЕ РЕМОНТНО-СТРОИТЕЛЬНОЕ УПРАВЛЕНИЕ""",https://zakupki.gov.ru/epz/organization/view/info.html?organizationId=2615998,4900000.0,54,Новосибирская область,2026-04-25T20:04:25.058121
1051500004726000014,https://zakupki.gov.ru/epz/order/notice/zk20/view/common-info.html?regNumber=1051500004726000014,44-ФЗ,44-ФЗ                                    Запрос котировок в электронной форме,Определение поставщика завершено,"Оказание авиационных услуг по защите леса от пожаров с использованием авиации - для проведения заказчиком лесоавиационных работ, в том числе, патрулирования и тушения лесных пожаров на территории Новосибирской области по лесопатрульному маршруту","ГОСУДАРСТВЕННОЕ АВТОНОМНОЕ УЧРЕЖДЕНИЕ НОВОСИБИРСКОЙ ОБЛАСТИ ""НОВОСИБИРСКАЯ БАЗА АВИАЦИОННОЙ ОХРАНЫ ЛЕСОВ""",https://zakupki.gov.ru/epz/organization/view/info.html?organizationId=2178403,1000000.0,54,Новосибирская область,2026-04-25T20:04:25.059016
0387200009126001761,https://zakupki.gov.ru/epz/order/notice/zk20/view/common-info.html?regNumber=0387200009126001761,44-ФЗ,44-ФЗ                                    Запрос котировок в электронной форме,Подача заявок,Поставка медицинских изделий: Инсуффлятора-аспиратора для оснащения (дооснащения) структурных подразделений медицинских организаций в рамках мероприятий по развитию паллиативной медицинской помощи.,"КАЗЕННОЕ УЧРЕЖДЕНИЕ ХАНТЫ-МАНСИЙСКОГО АВТОНОМНОГО ОКРУГА - ЮГРЫ ""ЦЕНТР ЛЕКАРСТВЕННОГО МОНИТОРИНГА""",https://zakupki.gov.ru/epz/organization/view/info.html?organizationId=736279,728816.67,54,Новосибирская область,2026-04-25T20:04:25.059836
0387200009126001760,https://zakupki.gov.ru/epz/order/notice/zk20/view/common-info.html?regNumber=0387200009126001760,44-ФЗ,44-ФЗ                                    Запрос котировок в электронной форме,Подача заявок,"Поставка медицинского изделия: Анализатор газов крови/гемоксиметр ИВД, для использования вблизи пациента для оснащения (дооснащения) перинатальных центров и родильных домов в рамках регионального проекта «Охрана материнства и детства»","КАЗЕННОЕ УЧРЕЖДЕНИЕ ХАНТЫ-МАНСИЙСКОГО АВТОНОМНОГО ОКРУГА - ЮГРЫ ""ЦЕНТР ЛЕКАРСТВЕННОГО МОНИТОРИНГА""",https://zakupki.gov.ru/epz/organization/view/info.html?organizationId=736279,729666.67,54,Новосибирская область,2026-04-25T20:04:25.060649
32615951176,https://zakupki.gov.ru/epz/order/notice/notice223/common-info.html?noticeInfoId=19705085,223-ФЗ,"223-ФЗ                                    Аукцион в электронной форме, участниками которого могут являться только субъекты малого и среднего предпринимательства",Подача заявок,"Закупка медицинских изделий для обеспечения пациентов, нуждающихся в паллиативной медицинской помощи, медицинскими изделиями, предназначенными для поддержания функций органов и систем организма человека, для использования на дому","ГОСУДАРСТВЕННОЕ АВТОНОМНОЕ УЧРЕЖДЕНИЕ ЗДРАВООХРАНЕНИЯ СВЕРДЛОВСКОЙ ОБЛАСТИ ""ДЕТСКАЯ ГОРОДСКАЯ БОЛЬНИЦА ГОРОД ПЕРВОУРАЛЬСК""",https://zakupki.gov.ru/epz/organization/view223/info.html?agencyId=492691,5499737.61,54,Новосибирская область,2026-04-25T20:04:25.061488
0851600011226000009,https://zakupki.gov.ru/epz/order/notice/zk20/view/common-info.html?regNumber=0851600011226000009,44-ФЗ,44-ФЗ                                    Запрос котировок в электронной форме,Подача заявок,"Выполнение работ по восстановлению отделки муниципальных нежилых помещений после страхового события по адресам: г. Новосибирск, ул. Республиканская, 11; ул. Промышленная, 1; ул. Вокзальная магистраль, 18; ул. Писарева, 4","МУНИЦИПАЛЬНОЕ КАЗЕННОЕ УЧРЕЖДЕНИЕ ГОРОДА НОВОСИБИРСКА ""ЦЕНТР МУНИЦИПАЛЬНОГО ИМУЩЕСТВА""",https://zakupki.gov.ru/epz/organization/view/info.html?organizationId=2687001,444838.14,54,Новосибирская область,2026-04-25T20:04:25.062323
0851600011226000012,https://zakupki.gov.ru/epz/order/notice/zk20/view/common-info.html?regNumber=0851600011226000012,44-ФЗ,44-ФЗ                                    Запрос котировок в электронной форме,Подача заявок,"Проведение работ по установке ограждения из стальной проволоки (рабица) периметра здания по адресу: г. Новосибирск, ул. Тухачевского, 21","МУНИЦИПАЛЬНОЕ КАЗЕННОЕ УЧРЕЖДЕНИЕ ГОРОДА НОВОСИБИРСКА ""ЦЕНТР МУНИЦИПАЛЬНОГО ИМУЩЕСТВА""",https://zakupki.gov.ru/epz/organization/view/info.html?organizationId=2687001,426192.97,54,Новосибирская область,2026-04-25T20:04:25.063121
0851600011226000011,https://zakupki.gov.ru/epz/order/notice/zk20/view/common-info.html?regNumber=0851600011226000011,44-ФЗ,44-ФЗ                                    Запрос котировок в электронной форме,Подача заявок,"Выполнение работ по восстановлению отделки муниципальных нежилых помещений после страхового события по адресам: г. Новосибирск, ул. Сибиряков-Гвардейцев, 22; ул. Комсомольская, 2; ул. Вертковская, 33","МУНИЦИПАЛЬНОЕ КАЗЕННОЕ УЧРЕЖДЕНИЕ ГОРОДА НОВОСИБИРСКА ""ЦЕНТР МУНИЦИПАЛЬНОГО ИМУЩЕСТВА""",https://zakupki.gov.ru/epz/organization/view/info.html?organizationId=2687001,474790.5,54,Новосибирская область,2026-04-25T20:04:25.064356
0851600011226000010,https://zakupki.gov.ru/epz/order/notice/zk20/view/common-info.html?regNumber=0851600011226000010,44-ФЗ,44-ФЗ                                    Запрос котировок в электронной форме,Подача заявок,"Выполнение работ по восстановлению отделки муниципальных нежилых помещений после страхового события по адресам: г. Новосибирск, ул. Римского-Корсакова, 10; ул. Ватутина, 15/1; ул. Связистов, 139/1; ул. 9-й Гвардейской Дивизии, 10; ул. Плахотного, 47","МУНИЦИПАЛЬНОЕ КАЗЕННОЕ УЧРЕЖДЕНИЕ ГОРОДА НОВОСИБИРСКА ""ЦЕНТР МУНИЦИПАЛЬНОГО ИМУЩЕСТВА""",https://zakupki.gov.ru/epz/organization/view/info.html?organizationId=2687001,364258.86,54,Новосибирская область,2026-04-25T20:04:25.065652
32615951175,https://zakupki.gov.ru/epz/order/notice/notice223/common-info.html?noticeInfoId=19705084,223-ФЗ,223-ФЗ                                    Прочие,Закупка завершена,"Монтаж ограждения и распашных ворот на территории газовой котельной по адресу: г. Екатеринбург, пос. Шабровский, ул. Ленина, 1а","МУНИЦИПАЛЬНОЕ УНИТАРНОЕ ПРЕДПРИЯТИЕ ""ЕКАТЕРИНБУРГЭНЕРГО""",https://zakupki.gov.ru/epz/organization/view223/info.html?agencyId=6999,221737.5,54,Новосибирская область,2026-04-25T20:04:28.603901
0312200024826000050,https://zakupki.gov.ru/epz/order/notice/ezt20/view/common-info.html?regNumber=0312200024826000050,44-ФЗ,"44-ФЗ                                    Закупка, осуществляемая в соответствии с частью 12 статьи 93 Закона № 44-ФЗ",Определение поставщика завершено,Металлодетектор,РЕСПУБЛИКАНСКОЕ ГОСУДАРСТВЕННОЕ БЮДЖЕТНОЕ УЧРЕЖДЕНИЕ ЦЕНТР СПОРТИВНОЙ ПОДГОТОВКИ СБОРНЫХ КОМАНД РЕСПУБЛИКИ ТЫВА,https://zakupki.gov.ru/epz/organization/view/info.html?organizationId=1992718,320000.0,54,Новосибирская область,2026-04-25T20:04:28.604777
0312200024826000049,https://zakupki.gov.ru/epz/order/notice/ezt20/view/common-info.html?regNumber=0312200024826000049,44-ФЗ,"44-ФЗ                                    Закупка, осуществляемая в соответствии с частью 12 статьи 93 Закона № 44-ФЗ",Определение поставщика завершено,Оборудование подъемно-транспортное и его части,РЕСПУБЛИКАНСКОЕ ГОСУДАРСТВЕННОЕ БЮДЖЕТНОЕ УЧРЕЖДЕНИЕ ЦЕНТР СПОРТИВНОЙ ПОДГОТОВКИ СБОРНЫХ КОМАНД РЕСПУБЛИКИ ТЫВА,https://zakupki.gov.ru/epz/organization/view/info.html?organizationId=1992718,4797590.0,54,Новосибирская область,2026-04-25T20:04:28.605645
0319200069426000305,https://zakupki.gov.ru/epz/order/notice/ezt20/view/common-info.html?regNumber=0319200069426000305,44-ФЗ,"44-ФЗ                                    Закупка, осуществляемая в соответствии с частью 12 статьи 93 Закона № 44-ФЗ",Определение поставщика завершено,,"КРАЕВОЕ ГОСУДАРСТВЕННОЕ БЮДЖЕТНОЕ УЧРЕЖДЕНИЕ ЗДРАВООХРАНЕНИЯ ""ТАЙМЫРСКАЯ МЕЖРАЙОННАЯ БОЛЬНИЦА""",https://zakupki.gov.ru/epz/organization/view/info.html?organizationId=2146474,35943.61,54,Новосибирская область,2026-04-25T20:04:28.606772
0301200044826000029,https://zakupki.gov.ru/epz/order/notice/ea20/view/common-info.html?regNumber=0301200044826000029,44-ФЗ,44-ФЗ                                    Электронный аукцион,Подача заявок,Оказание услуг по очистке и дезинфекции систем вентиляции,ГОСУДАРСТВЕННОЕ БЮДЖЕТНОЕ УЧРЕЖДЕНИЕ ЗДРАВООХРАНЕНИЯ БЮРО СУДЕБНО-МЕДИЦИНСКОЙ ЭКСПЕРТИЗЫ МИНИСТЕРСТВА ЗДРАВООХРАНЕНИЯ РЕСПУБЛИКИ БАШКОРТОСТАН,https://zakupki.gov.ru/epz/organization/view/info.html?organizationId=718788,300000.0,54,Новосибирская область,2026-04-25T20:04:28.608015
0351200016526000005,https://zakupki.gov.ru/epz/order/notice/zk20/view/common-info.html?regNumber=0351200016526000005,44-ФЗ,44-ФЗ                                    Запрос котировок в электронной форме,Подача заявок,Поставка экспресс-тестов иммунохроматографических для выявления наркотических веществ в моче (13 видов),"ГОСУДАРСТВЕННОЕ БЮДЖЕТНОЕ УЧРЕЖДЕНИЕ ЗДРАВООХРАНЕНИЯ НОВОСИБИРСКОЙ ОБЛАСТИ ""НОВОСИБИРСКИЙ ОБЛАСТНОЙ КЛИНИЧЕСКИЙ НАРКОЛОГИЧЕСКИЙ ДИСПАНСЕР""",https://zakupki.gov.ru/epz/organization/view/info.html?organizationId=759206,2964000.0,54,Новосибирская область,2026-04-25T20:04:28.608855
0346200015626000007,https://zakupki.gov.ru/epz/order/notice/ea20/view/common-info.html?regNumber=0346200015626000007,44-ФЗ,44-ФЗ                                    Электронный аукцион,Подача заявок,"Поставка медицинского изделия (аппарат для ингаляционного наркоза), ввод в эксплуатацию медицинского изделия, обучение правилам эксплуатации специалистов, эксплуатирующих медицинское изделие, и специалистов, осуществляющих техническое обслуживание медицинского изделия.","ОБЛАСТНОЕ КАЗЕННОЕ УЧРЕЖДЕНИЕ ""УПРАВЛЕНИЕ КАПИТАЛЬНОГО СТРОИТЕЛЬСТВА ЛИПЕЦКОЙ ОБЛАСТИ""",https://zakupki.gov.ru/epz/organization/view/info.html?organizationId=683437,9017386.66,54,Новосибирская область,2026-04-25T20:04:28.609667
0359100003526000004,https://zakupki.gov.ru/epz/order/notice/ea20/view/common-info.html?regNumber=0359100003526000004,44-ФЗ,44-ФЗ                                    Электронный аукцион,Подача заявок,"Поставка мебели в общежитие №1 РГУ имени С.А. Есенина, расположенное по адресу: г. Рязань, ул. Урицкого, д.22, с последующей сборкой и установкой","ФЕДЕРАЛЬНОЕ ГОСУДАРСТВЕННОЕ БЮДЖЕТНОЕ ОБРАЗОВАТЕЛЬНОЕ УЧРЕЖДЕНИЕ ВЫСШЕГО ОБРАЗОВАНИЯ ""РЯЗАНСКИЙ ГОСУДАРСТВЕННЫЙ УНИВЕРСИТЕТ ИМЕНИ С.А. ЕСЕНИНА""",https://zakupki.gov.ru/epz/organization/view/info.html?organizationId=632429,9399138.59,54,Новосибирская область,2026-04-25T20:04:28.610483
0319200069426000304,https://zakupki.gov.ru/epz/order/notice/ezt20/view/common-info.html?regNumber=0319200069426000304,44-ФЗ,"44-ФЗ                                    Закупка, осуществляемая в соответствии с частью 12 статьи 93 Закона № 44-ФЗ",Определение поставщика завершено,,"КРАЕВОЕ ГОСУДАРСТВЕННОЕ БЮДЖЕТНОЕ УЧРЕЖДЕНИЕ ЗДРАВООХРАНЕНИЯ ""ТАЙМЫРСКАЯ МЕЖРАЙОННАЯ БОЛЬНИЦА""",https://zakupki.gov.ru/epz/organization/view/info.html?organizationId=2146474,35943.61,54,Новосибирская область,2026-04-25T20:04:28.611522
32615951172,https://zakupki.gov.ru/epz/order/notice/notice223/common-info.html?noticeInfoId=19705081,223-ФЗ,223-ФЗ                                    Прочие,Подача заявок,договор на поставку яиц куриных для МАДОУ «ДС № 355г. Челябинска».,"МУНИЦИПАЛЬНОЕ АВТОНОМНОЕ ДОШКОЛЬНОЕ ОБРАЗОВАТЕЛЬНОЕ УЧРЕЖДЕНИЕ ""ДЕТСКИЙ САД № 355 Г.ЧЕЛЯБИНСКА""",https://zakupki.gov.ru/epz/organization/view223/info.html?agencyId=60450,195200.0,54,Новосибирская область,2026-04-25T20:04:28.612476
0301200044826000028,https://zakupki.gov.ru/epz/order/notice/ea20/view/common-info.html?regNumber=0301200044826000028,44-ФЗ,44-ФЗ                                    Электронный аукцион,Подача заявок,Поставка накопителей данных внутренних,ГОСУДАРСТВЕННОЕ БЮДЖЕТНОЕ УЧРЕЖДЕНИЕ ЗДРАВООХРАНЕНИЯ БЮРО СУДЕБНО-МЕДИЦИНСКОЙ ЭКСПЕРТИЗЫ МИНИСТЕРСТВА ЗДРАВООХРАНЕНИЯ РЕСПУБЛИКИ БАШКОРТОСТАН,https://zakupki.gov.ru/epz/organization/view/info.html?organizationId=718788,88164.0,54,Новосибирская область,2026-04-25T20:04:31.250420
