reg_number,url,law,purchase_method,status,object_name,customer_name,customer_url,initial_price,region_code,region_name,scraped_at
32615951161,https://zakupki.gov.ru/epz/order/notice/notice223/common-info.html?noticeInfoId=19705063,223-ФЗ,223-ФЗ                                    Прочие,Подача заявок,Поставка лекарственного препарата Элькар 100 мл,ГОСУДАРСТВЕННОЕ УНИТАРНОЕ ПРЕДПРИЯТИЕ РЕСПУБЛИКИ АДЫГЕЯ АПТЕЧНАЯ БАЗА,https://zakupki.gov.ru/epz/organization/view223/info.html?agencyId=1767,1643600.0,77,Москва,2026-04-25T20:08:24.375017
32615951160,https://zakupki.gov.ru/epz/order/notice/notice223/common-info.html?noticeInfoId=19705064,223-ФЗ,223-ФЗ                                    Прочие,Подача заявок,Поставка лекарственного препарата Элькар 5 мл,ГОСУДАРСТВЕННОЕ УНИТАРНОЕ ПРЕДПРИЯТИЕ РЕСПУБЛИКИ АДЫГЕЯ АПТЕЧНАЯ БАЗА,https://zakupki.gov.ru/epz/organization/view223/info.html?agencyId=1767,684000.0,77,Москва,2026-04-25T20:08:24.376093
32615951149,https://zakupki.gov.ru/epz/order/notice/notice223/common-info.html?noticeInfoId=19705050,223-ФЗ,"223-ФЗ                                    Аукцион в электронной форме, участниками которого могут являться только субъекты малого и среднего предпринимательства",Подача заявок,Замена ограждения (частично),"МУНИЦИПАЛЬНОЕ ОБЩЕОБРАЗОВАТЕЛЬНОЕ АВТОНОМНОЕ УЧРЕЖДЕНИЕ ""СРЕДНЯЯ ОБЩЕОБРАЗОВАТЕЛЬНАЯ ШКОЛА №76""",https://zakupki.gov.ru/epz/organization/view223/info.html?agencyId=491834,1496588.09,77,Москва,2026-04-25T20:08:24.376961
32615937467,https://zakupki.gov.ru/epz/order/notice/notice223/common-info.html?noticeInfoId=19705060,223-ФЗ,223-ФЗ                                    Прочие,Подача заявок,Поставка материалов в рамках подготовки к грозовому сезону и для проведения плановых ремонтов ВЛ для нужд Филиала АО «АЭСК» г. Мончегорск,"АКЦИОНЕРНОЕ ОБЩЕСТВО ""АПАТИТСКАЯ ЭЛЕКТРОСЕТЕВАЯ КОМПАНИЯ""",https://zakupki.gov.ru/epz/organization/view223/info.html?agencyId=754558,996812.11,77,Москва,2026-04-25T20:08:24.377952
0348100021726000042,https://zakupki.gov.ru/epz/order/notice/ok20/view/common-info.html?regNumber=0348100021726000042,44-ФЗ,44-ФЗ                                    Открытый конкурс в электронной форме,Подача заявок,"Выполнение работ по содержанию, эксплуатации и текущему ремонту объектов",УПРАВЛЕНИЕ СУДЕБНОГО ДЕПАРТАМЕНТА В МОСКОВСКОЙ ОБЛАСТИ,https://zakupki.gov.ru/epz/organization/view/info.html?organizationId=784499,11741400.0,77,Москва,2026-04-25T20:08:24.379709
0322300059126000353,https://zakupki.gov.ru/epz/order/notice/ea20/view/common-info.html?regNumber=0322300059126000353,44-ФЗ,44-ФЗ                                    Электронный аукцион,Подача заявок,"Поставка лезвий ручного скальпеля, одноразового использования","КРАЕВОЕ ГОСУДАРСТВЕННОЕ БЮДЖЕТНОЕ УЧРЕЖДЕНИЕ ЗДРАВООХРАНЕНИЯ ""ГОРОДСКАЯ БОЛЬНИЦА № 7"" МИНИСТЕРСТВА ЗДРАВООХРАНЕНИЯ ХАБАРОВСКОГО КРАЯ",https://zakupki.gov.ru/epz/organization/view/info.html?organizationId=764000,5620.0,77,Москва,2026-04-25T20:08:24.381298
0322300059126000352,https://zakupki.gov.ru/epz/order/notice/ea20/view/common-info.html?regNumber=0322300059126000352,44-ФЗ,44-ФЗ                                    Электронный аукцион,Подача заявок,"Поставка скальпелей, одноразового использования","КРАЕВОЕ ГОСУДАРСТВЕННОЕ БЮДЖЕТНОЕ УЧРЕЖДЕНИЕ ЗДРАВООХРАНЕНИЯ ""ГОРОДСКАЯ БОЛЬНИЦА № 7"" МИНИСТЕРСТВА ЗДРАВООХРАНЕНИЯ ХАБАРОВСКОГО КРАЯ",https://zakupki.gov.ru/epz/organization/view/info.html?organizationId=764000,162425.0,77,Москва,2026-04-25T20:08:24.382737
0322300059126000348,https://zakupki.gov.ru/epz/order/notice/ea20/view/common-info.html?regNumber=0322300059126000348,44-ФЗ,44-ФЗ                                    Электронный аукцион,Подача заявок,"Поставка медицинских изделий: Анализатор лактата, ввод в эксплуатацию медицинских изделий, обучение правилам эксплуатации специалистов, эксплуатирующих медицинские изделия","КРАЕВОЕ ГОСУДАРСТВЕННОЕ БЮДЖЕТНОЕ УЧРЕЖДЕНИЕ ЗДРАВООХРАНЕНИЯ ""ГОРОДСКАЯ БОЛЬНИЦА № 7"" МИНИСТЕРСТВА ЗДРАВООХРАНЕНИЯ ХАБАРОВСКОГО КРАЯ",https://zakupki.gov.ru/epz/organization/view/info.html?organizationId=764000,109500.0,77,Москва,2026-04-25T20:08:24.384154
0346300076826000181,https://zakupki.gov.ru/epz/order/notice/ea20/view/common-info.html?regNumber=0346300076826000181,44-ФЗ,44-ФЗ                                    Электронный аукцион,Подача заявок,26-ЭА-182 лекарственный препарат для медицинского применения (Адеметионин для паллиативного отделения),"ГОСУДАРСТВЕННОЕ УЧРЕЖДЕНИЕ ЗДРАВООХРАНЕНИЯ ""ЕЛЕЦКАЯ ГОРОДСКАЯ КЛИНИЧЕСКАЯ БОЛЬНИЦА  ИМ. Н. А. СЕМАШКО""",https://zakupki.gov.ru/epz/organization/view/info.html?organizationId=616177,23100.0,77,Москва,2026-04-25T20:08:24.385581
32615939132,https://zakupki.gov.ru/epz/order/notice/notice223/common-info.html?noticeInfoId=19705046,223-ФЗ,"223-ФЗ                                    Аукцион в электронной форме, участниками которого могут являться только субъекты малого и среднего предпринимательства",Подача заявок,Поставка лекарственных препаратов для обеспечения беременных,"ГОСУДАРСТВЕННОЕ АВТОНОМНОЕ УЧРЕЖДЕНИЕ ЗДРАВООХРАНЕНИЯ СВЕРДЛОВСКОЙ ОБЛАСТИ ""АРАМИЛЬСКАЯ ГОРОДСКАЯ БОЛЬНИЦА""",https://zakupki.gov.ru/epz/organization/view223/info.html?agencyId=549345,265553.0,77,Москва,2026-04-25T20:08:24.386853
0418200002426000001,https://zakupki.gov.ru/epz/order/notice/ok20/view/common-info.html?regNumber=0418200002426000001,44-ФЗ,44-ФЗ                                    Открытый конкурс в электронной форме для заключения договора на проведение аудита бухгалтерской (финансовой) отчетности (согласно ч. 4 ст. 5 Федерального закона от 30.12.2008г. № 307-ФЗ),Подача заявок,Услуги по проведению финансового аудита,"НЕПУБЛИЧНОЕ АКЦИОНЕРНОЕ ОБЩЕСТВО ""КРАСНОДАРДОРНЕРУД",https://zakupki.gov.ru/epz/organization/view/info.html?organizationId=1361701,100000.0,77,Москва,2026-04-25T20:08:27.357918
0301100003226000025,https://zakupki.gov.ru/epz/order/notice/ea20/view/common-info.html?regNumber=0301100003226000025,44-ФЗ,44-ФЗ                                    Электронный аукцион,Подача заявок,Прочая закупка товаров в целях текущего ремонта государственного имущества(строительные материалы и оборудование),"ФЕДЕРАЛЬНОЕ КАЗЕННОЕ УЧРЕЖДЕНИЕ ""КОЛОНИЯ-ПОСЕЛЕНИЕ № 8 УПРАВЛЕНИЯ ФЕДЕРАЛЬНОЙ СЛУЖБЫ ИСПОЛНЕНИЯ НАКАЗАНИЙ ПО РЕСПУБЛИКЕ БАШКОРТОСТАН""",https://zakupki.gov.ru/epz/organization/view/info.html?organizationId=629130,633284.7,77,Москва,2026-04-25T20:08:27.359318
0862300006326000059,https://zakupki.gov.ru/epz/order/notice/ea20/view/common-info.html?regNumber=0862300006326000059,44-ФЗ,44-ФЗ                                    Электронный аукцион,Подача заявок,"Устройство детского игрового оборудования у д.58 по ул. Неделина (поставка, установка)","МУНИЦИПАЛЬНОЕ КАЗЕННОЕ УЧРЕЖДЕНИЕ ""АДМИНИСТРАТИВНО-ХОЗЯЙСТВЕННАЯ СЛУЖБА""",https://zakupki.gov.ru/epz/organization/view/info.html?organizationId=1392886,3177232.82,77,Москва,2026-04-25T20:08:27.360783
0124300016426000039,https://zakupki.gov.ru/epz/order/notice/ea20/view/common-info.html?regNumber=0124300016426000039,44-ФЗ,44-ФЗ                                    Электронный аукцион,Подача заявок,Бумага для офисной техники,АДМИНИСТРАЦИЯ ОНЕЖСКОГО МУНИЦИПАЛЬНОГО ОКРУГА АРХАНГЕЛЬСКОЙ ОБЛАСТИ,https://zakupki.gov.ru/epz/organization/view/info.html?reestrNumber=689430,200514.9,77,Москва,2026-04-25T20:08:27.362026
0301200058826000068,https://zakupki.gov.ru/epz/order/notice/ea20/view/common-info.html?regNumber=0301200058826000068,44-ФЗ,44-ФЗ                                    Электронный аукцион,Подача заявок,"Капитальный ремонт по замене деревянных окон на ПВХ стационара ГБУЗ РКНД МЗ РБ по адресу:450045,Республика Башкортостан,г.Уфа,ул.Хусаина Ямашева,1",ГОСУДАРСТВЕННОЕ БЮДЖЕТНОЕ УЧРЕЖДЕНИЕ ЗДРАВООХРАНЕНИЯ РЕСПУБЛИКАНСКИЙ КЛИНИЧЕСКИЙ НАРКОЛОГИЧЕСКИЙ ДИСПАНСЕР МИНИСТЕРСТВА ЗДРАВООХРАНЕНИЯ РЕСПУБЛИКИ БАШКОРТОСТАН,https://zakupki.gov.ru/epz/organization/view/info.html?organizationId=777341,1638464.37,77,Москва,2026-04-25T20:08:27.362962
32615950979,https://zakupki.gov.ru/epz/order/notice/notice223/common-info.html?noticeInfoId=19705056,223-ФЗ,223-ФЗ                                    Прочие,Подача заявок,"РКСМ-1846 Запрос котировок в электронной форме (попозиционный) (далее-закупка) на право заключения договоров поставки оргтехники для нужд ООО ""НОВОГОР-Прикамье"", ООО ""Самарские коммунальные системы"", ООО ""Амурские коммунальные системы"", АО ""ПКС-ВОДОКАНАЛ"", АО ""ПКС-Тепловые сети"", ООО ""Горводоканал"", ООО ""Волжские коммунальные системы"", ООО ""РКС-Тамбов"", ООО ""Нижневартовские коммунальные системы"", ООО «ЭНЕРГОКОМФОРТ. КАРЕЛИЯ», ООО «БВК».","ОБЩЕСТВО С ОГРАНИЧЕННОЙ ОТВЕТСТВЕННОСТЬЮ ""РКС-ХОЛДИНГ""",https://zakupki.gov.ru/epz/organization/view223/info.html?agencyId=552231,33365741.7,77,Москва,2026-04-25T20:08:27.364027
32615951145,https://zakupki.gov.ru/epz/order/notice/notice223/common-info.html?noticeInfoId=19705043,223-ФЗ,223-ФЗ                                    Прочие,Подача заявок,Поставка лекарственных препаратов для медицинского применения (МНН Золендроновая кислота),"ГОСУДАРСТВЕННОЕ АВТОНОМНОЕ УЧРЕЖДЕНИЕ ЗДРАВООХРАНЕНИЯ СВЕРДЛОВСКОЙ ОБЛАСТИ ""БЕРЕЗОВСКАЯ ЦЕНТРАЛЬНАЯ ГОРОДСКАЯ БОЛЬНИЦА""",https://zakupki.gov.ru/epz/organization/view223/info.html?agencyId=102109,352687.5,77,Москва,2026-04-25T20:08:27.364877
0190200000326004733,https://zakupki.gov.ru/epz/order/notice/ea20/view/common-info.html?regNumber=0190200000326004733,44-ФЗ,44-ФЗ                                    Электронный аукцион,Подача заявок,Поставка лекарственного препарата для медицинского применения Вилантерол+Умеклидиния бромид,ДЕПАРТАМЕНТ ГОСУДАРСТВЕННОГО ЗАКАЗА ЯМАЛО-НЕНЕЦКОГО АВТОНОМНОГО ОКРУГА,https://zakupki.gov.ru/epz/organization/view/info.html?reestrNumber=711308,76968.0,77,Москва,2026-04-25T20:08:27.366152
0190200000326004732,https://zakupki.gov.ru/epz/order/notice/ea20/view/common-info.html?regNumber=0190200000326004732,44-ФЗ,44-ФЗ                                    Электронный аукцион,Подача заявок,Поставка лекарственного препарата для медицинского применения ТРАНЕКСАМОВАЯ КИСЛОТА,ДЕПАРТАМЕНТ ГОСУДАРСТВЕННОГО ЗАКАЗА ЯМАЛО-НЕНЕЦКОГО АВТОНОМНОГО ОКРУГА,https://zakupki.gov.ru/epz/organization/view/info.html?reestrNumber=711308,973350.0,77,Москва,2026-04-25T20:08:27.367070
0348300029126000137,https://zakupki.gov.ru/epz/order/notice/ea20/view/common-info.html?regNumber=0348300029126000137,44-ФЗ,44-ФЗ                                    Электронный аукцион,Определение поставщика завершено,Поставка реагентов сложных  диагностических для исследований методом иммуно-ферментного анализа (ИФА) (централизованная лаборатория),"ГОСУДАРСТВЕННОЕ БЮДЖЕТНОЕ УЧРЕЖДЕНИЕ ЗДРАВООХРАНЕНИЯ МОСКОВСКОЙ ОБЛАСТИ ""ДОМОДЕДОВСКАЯ БОЛЬНИЦА""",https://zakupki.gov.ru/epz/organization/view/info.html?organizationId=667419,4497693.88,77,Москва,2026-04-25T20:08:27.368122
0348300029126000135,https://zakupki.gov.ru/epz/order/notice/ea20/view/common-info.html?regNumber=0348300029126000135,44-ФЗ,44-ФЗ                                    Электронный аукцион,Определение поставщика завершено,Поставка набора на иммуноферментный анализ (централизованная лаборатория),"ГОСУДАРСТВЕННОЕ БЮДЖЕТНОЕ УЧРЕЖДЕНИЕ ЗДРАВООХРАНЕНИЯ МОСКОВСКОЙ ОБЛАСТИ ""ДОМОДЕДОВСКАЯ БОЛЬНИЦА""",https://zakupki.gov.ru/epz/organization/view/info.html?organizationId=667419,8685993.0,77,Москва,2026-04-25T20:08:30.866019
0348300029126000138,https://zakupki.gov.ru/epz/order/notice/ea20/view/common-info.html?regNumber=0348300029126000138,44-ФЗ,44-ФЗ                                    Электронный аукцион,Определение поставщика завершено,"Поставка расходного материала  для гематологического анализатора Sysmex, с возможностью исследования венозной, капиллярной крови и биологических жидкостей (спинномозговой, серозной (перитонеальная и плевральная), синовиальной), совместимых с анализатором и реагентами, имеющимися  в лаборатории (ЛОТ 3) (централизованная лаборатория)","ГОСУДАРСТВЕННОЕ БЮДЖЕТНОЕ УЧРЕЖДЕНИЕ ЗДРАВООХРАНЕНИЯ МОСКОВСКОЙ ОБЛАСТИ ""ДОМОДЕДОВСКАЯ БОЛЬНИЦА""",https://zakupki.gov.ru/epz/organization/view/info.html?organizationId=667419,11858307.77,77,Москва,2026-04-25T20:08:30.867083
0190200000326004731,https://zakupki.gov.ru/epz/order/notice/ea20/view/common-info.html?regNumber=0190200000326004731,44-ФЗ,44-ФЗ                                    Электронный аукцион,Подача заявок,Поставка лекарственных препаратов для медицинского применения,ДЕПАРТАМЕНТ ГОСУДАРСТВЕННОГО ЗАКАЗА ЯМАЛО-НЕНЕЦКОГО АВТОНОМНОГО ОКРУГА,https://zakupki.gov.ru/epz/organization/view/info.html?reestrNumber=711308,21670.6,77,Москва,2026-04-25T20:08:30.868711
0348300029126000142,https://zakupki.gov.ru/epz/order/notice/ea20/view/common-info.html?regNumber=0348300029126000142,44-ФЗ,44-ФЗ                                    Электронный аукцион,Определение поставщика завершено,Поставка иммунохроматографических тест-систем и тест-полосок (централизованная лаборатория),"ГОСУДАРСТВЕННОЕ БЮДЖЕТНОЕ УЧРЕЖДЕНИЕ ЗДРАВООХРАНЕНИЯ МОСКОВСКОЙ ОБЛАСТИ ""ДОМОДЕДОВСКАЯ БОЛЬНИЦА""",https://zakupki.gov.ru/epz/organization/view/info.html?organizationId=667419,3852389.4,77,Москва,2026-04-25T20:08:30.870205
0190200000326004730,https://zakupki.gov.ru/epz/order/notice/zk20/view/common-info.html?regNumber=0190200000326004730,44-ФЗ,44-ФЗ                                    Запрос котировок в электронной форме,Подача заявок,Поставка лекарственного препарата для медицинского применения МНН Ламотриджин ТН Ламиктал,ДЕПАРТАМЕНТ ГОСУДАРСТВЕННОГО ЗАКАЗА ЯМАЛО-НЕНЕЦКОГО АВТОНОМНОГО ОКРУГА,https://zakupki.gov.ru/epz/organization/view/info.html?reestrNumber=711308,13066.2,77,Москва,2026-04-25T20:08:30.871651
0190200000326004729,https://zakupki.gov.ru/epz/order/notice/ea20/view/common-info.html?regNumber=0190200000326004729,44-ФЗ,44-ФЗ                                    Электронный аукцион,Подача заявок,"Поставка медицинских изделий для травматологии - Эндопротез головки бедренной кости металлический;вкладыш для ацетабулярного компонента эндопротеза тазобедренного сустава не ограничивающий движения полиэтиленовый;винт костный ортопедический, нерассасывающийся, стерильный",ДЕПАРТАМЕНТ ГОСУДАРСТВЕННОГО ЗАКАЗА ЯМАЛО-НЕНЕЦКОГО АВТОНОМНОГО ОКРУГА,https://zakupki.gov.ru/epz/organization/view/info.html?reestrNumber=711308,1330000.0,77,Москва,2026-04-25T20:08:30.872951
0118400001726000011,https://zakupki.gov.ru/epz/order/notice/ea20/view/common-info.html?regNumber=0118400001726000011,44-ФЗ,44-ФЗ                                    Электронный аукцион,Подача заявок,Оказание в сфере информационно-коммуникационных технологий услуг сотовой радиотелефонной связи стандарта GSM 900/1800,СОЧИНСКАЯ ТАМОЖНЯ,https://zakupki.gov.ru/epz/organization/view/info.html?organizationId=7057982,160000.0,77,Москва,2026-04-25T20:08:30.874133
0190200000326004728,https://zakupki.gov.ru/epz/order/notice/ea20/view/common-info.html?regNumber=0190200000326004728,44-ФЗ,44-ФЗ                                    Электронный аукцион,Подача заявок,Поставка медицинского изделия: Набор для переливания крови,ДЕПАРТАМЕНТ ГОСУДАРСТВЕННОГО ЗАКАЗА ЯМАЛО-НЕНЕЦКОГО АВТОНОМНОГО ОКРУГА,https://zakupki.gov.ru/epz/organization/view/info.html?reestrNumber=711308,3371500.0,77,Москва,2026-04-25T20:08:30.875019
0190200000326004727,https://zakupki.gov.ru/epz/order/notice/ea20/view/common-info.html?regNumber=0190200000326004727,44-ФЗ,44-ФЗ                                    Электронный аукцион,Подача заявок,"Поставка изделий медицинского назначения(Корзина для удаления желчных/мочевых камней, многоразового использования)",ДЕПАРТАМЕНТ ГОСУДАРСТВЕННОГО ЗАКАЗА ЯМАЛО-НЕНЕЦКОГО АВТОНОМНОГО ОКРУГА,https://zakupki.gov.ru/epz/organization/view/info.html?reestrNumber=711308,367450.0,77,Москва,2026-04-25T20:08:30.875866
0190200000326004726,https://zakupki.gov.ru/epz/order/notice/ea20/view/common-info.html?regNumber=0190200000326004726,44-ФЗ,44-ФЗ                                    Электронный аукцион,Подача заявок,Поставка лекарственного препарата для медицинского применения Карбоплатин,ДЕПАРТАМЕНТ ГОСУДАРСТВЕННОГО ЗАКАЗА ЯМАЛО-НЕНЕЦКОГО АВТОНОМНОГО ОКРУГА,https://zakupki.gov.ru/epz/organization/view/info.html?reestrNumber=711308,692887.5,77,Москва,2026-04-25T20:08:30.876748
0190200000326004725,https://zakupki.gov.ru/epz/order/notice/ea20/view/common-info.html?regNumber=0190200000326004725,44-ФЗ,44-ФЗ                                    Электронный аукцион,Подача заявок,Поставка лекарственного препарата для применения в медицинских целях МНН ДИОКСОМЕТИЛТЕТРАГИДРОПИРИМИДИН+СУЛЬФАДИМЕТОКСИН+ТРИМЕКАИН+ХЛОРАМФЕНИКОЛ,ДЕПАРТАМЕНТ ГОСУДАРСТВЕННОГО ЗАКАЗА ЯМАЛО-НЕНЕЦКОГО АВТОНОМНОГО ОКРУГА,https://zakupki.gov.ru/epz/organization/view/info.html?reestrNumber=711308,125600.0,77,Москва,2026-04-25T20:08:33.651441
0375200045226000023,https://zakupki.gov.ru/epz/order/notice/ea20/view/common-info.html?regNumber=0375200045226000023,44-ФЗ,44-ФЗ                                    Электронный аукцион,Определение поставщика завершено,Поставка медицинских изделий (реагенты),"ГОСУДАРСТВЕННОЕ БЮДЖЕТНОЕ УЧРЕЖДЕНИЕ РЕСПУБЛИКИ КРЫМ ""ЦЕНТР СПОРТИВНОЙ МЕДИЦИНЫ""",https://zakupki.gov.ru/epz/organization/view/info.html?organizationId=2145042,186487.85,77,Москва,2026-04-25T20:08:33.653120
0190200000326004724,https://zakupki.gov.ru/epz/order/notice/ea20/view/common-info.html?regNumber=0190200000326004724,44-ФЗ,44-ФЗ                                    Электронный аукцион,Подача заявок,Поставка лекарственного препарата для медицинского применения Эноксапарин натрия,ДЕПАРТАМЕНТ ГОСУДАРСТВЕННОГО ЗАКАЗА ЯМАЛО-НЕНЕЦКОГО АВТОНОМНОГО ОКРУГА,https://zakupki.gov.ru/epz/organization/view/info.html?reestrNumber=711308,1141402.2,77,Москва,2026-04-25T20:08:33.654245
0190200000326004723,https://zakupki.gov.ru/epz/order/notice/ea20/view/common-info.html?regNumber=0190200000326004723,44-ФЗ,44-ФЗ                                    Электронный аукцион,Подача заявок,"Поставка медицинского изделия (Чехол защитный для инвазивного датчика ультразвуковой визуализации, стандартный, нестерильный)",ДЕПАРТАМЕНТ ГОСУДАРСТВЕННОГО ЗАКАЗА ЯМАЛО-НЕНЕЦКОГО АВТОНОМНОГО ОКРУГА,https://zakupki.gov.ru/epz/organization/view/info.html?reestrNumber=711308,16000.0,77,Москва,2026-04-25T20:08:33.655110
