reg_number,url,law,purchase_method,status,object_name,customer_name,customer_url,initial_price,region_code,region_name,scraped_at
0310100000726000001,https://zakupki.gov.ru/epz/order/notice/zk20/view/common-info.html?regNumber=0310100000726000001,44-ФЗ,44-ФЗ                                    Запрос котировок в электронной форме,Определение поставщика завершено,Оказание услуг публикации объявлений в газете по продаже имущества,ТЕРРИТОРИАЛЬНОЕ УПРАВЛЕНИЕ ФЕДЕРАЛЬНОГО АГЕНТСТВА ПО УПРАВЛЕНИЮ ГОСУДАРСТВЕННЫМ ИМУЩЕСТВОМ В РЕСПУБЛИКЕ СЕВЕРНАЯ ОСЕТИЯ - АЛАНИЯ,https://zakupki.gov.ru/epz/organization/view/info.html?organizationId=614471,595000.0,54,Новосибирская область,2026-04-25T20:07:08.167465
32615951115,https://zakupki.gov.ru/epz/order/notice/notice223/common-info.html?noticeInfoId=19705010,223-ФЗ,223-ФЗ                                    Прочие,Подача заявок,Оказание услуг по организации горячего питания в лагерях дневного пребывания,"МУНИЦИПАЛЬНОЕ ОБЩЕОБРАЗОВАТЕЛЬНОЕ УЧРЕЖДЕНИЕ - СРЕДНЯЯ ОБЩЕОБРАЗОВАТЕЛЬНАЯ ШКОЛА ""СОДРУЖЕСТВО""",https://zakupki.gov.ru/epz/organization/view223/info.html?agencyId=752535,1801800.0,54,Новосибирская область,2026-04-25T20:07:08.168651
0372200065326000004,https://zakupki.gov.ru/epz/order/notice/ea20/view/common-info.html?regNumber=0372200065326000004,44-ФЗ,44-ФЗ                                    Электронный аукцион,Определение поставщика завершено,Выполнение работ по ремонту ИТП,ГОСУДАРСТВЕННОЕ БЮДЖЕТНОЕ ДОШКОЛЬНОЕ ОБРАЗОВАТЕЛЬНОЕ УЧРЕЖДЕНИЕ ДЕТСКИЙ САД № 21 КИРОВСКОГО РАЙОНА САНКТ-ПЕТЕРБУРГА,https://zakupki.gov.ru/epz/organization/view/info.html?organizationId=630777,828183.45,54,Новосибирская область,2026-04-25T20:07:08.169979
0372200065326000005,https://zakupki.gov.ru/epz/order/notice/ea20/view/common-info.html?regNumber=0372200065326000005,44-ФЗ,44-ФЗ                                    Электронный аукцион,Определение поставщика завершено,Выполнение работ по замене сантехнических приборов в здании ГБДОУ детский сад № 21 Кировского района Санкт-Петербурга по адресу: бульвар Новаторов дом 42 лит. А,ГОСУДАРСТВЕННОЕ БЮДЖЕТНОЕ ДОШКОЛЬНОЕ ОБРАЗОВАТЕЛЬНОЕ УЧРЕЖДЕНИЕ ДЕТСКИЙ САД № 21 КИРОВСКОГО РАЙОНА САНКТ-ПЕТЕРБУРГА,https://zakupki.gov.ru/epz/organization/view/info.html?organizationId=630777,250917.61,54,Новосибирская область,2026-04-25T20:07:08.170808
32615946146,https://zakupki.gov.ru/epz/order/notice/notice223/common-info.html?noticeInfoId=19705013,223-ФЗ,"223-ФЗ                                    Аукцион в электронной форме, участниками которого могут являться только субъекты малого и среднего предпринимательства",Подача заявок,"Аукцион в электронной форме на право заключения договора на поставку лекарственного (-ых) препарата (-ов) (Регорафениб, таблетки, покрытые пленочной оболочкой 40 мг № 84) для обеспечения граждан на территории Смоленской области.","ОБЛАСТНОЕ ГОСУДАРСТВЕННОЕ АВТОНОМНОЕ УЧРЕЖДЕНИЕ ЗДРАВООХРАНЕНИЯ ""СМОЛЕНСКИЙ ОБЛАСТНОЙ МЕДИЦИНСКИЙ ЦЕНТР""",https://zakupki.gov.ru/epz/organization/view223/info.html?agencyId=8746,26400780.0,54,Новосибирская область,2026-04-25T20:07:08.171635
0373100095226000324,https://zakupki.gov.ru/epz/order/notice/ea20/view/common-info.html?regNumber=0373100095226000324,44-ФЗ,44-ФЗ                                    Электронный аукцион,Определение поставщика завершено,"Поставка кардиовертеров-дефибрилляторов имплантируемых однокамерных, МРТ совместимых.","ФЕДЕРАЛЬНОЕ ГОСУДАРСТВЕННОЕ БЮДЖЕТНОЕ УЧРЕЖДЕНИЕ ""НАЦИОНАЛЬНЫЙ МЕДИЦИНСКИЙ ИССЛЕДОВАТЕЛЬСКИЙ ЦЕНТР СЕРДЕЧНО-СОСУДИСТОЙ ХИРУРГИИ ИМЕНИ А.Н. БАКУЛЕВА"" МИНИСТЕРСТВА ЗДРАВООХРАНЕНИЯ РОССИЙСКОЙ ФЕДЕРАЦИИ",https://zakupki.gov.ru/epz/organization/view/info.html?organizationId=762438,16732500.0,54,Новосибирская область,2026-04-25T20:07:08.172529
0373100095226000328,https://zakupki.gov.ru/epz/order/notice/ea20/view/common-info.html?regNumber=0373100095226000328,44-ФЗ,44-ФЗ                                    Электронный аукцион,Определение поставщика завершено,"Поставка кардиовертеров-дефибрилляторов имплантируемых двухкамерных, МРТ совместимых.","ФЕДЕРАЛЬНОЕ ГОСУДАРСТВЕННОЕ БЮДЖЕТНОЕ УЧРЕЖДЕНИЕ ""НАЦИОНАЛЬНЫЙ МЕДИЦИНСКИЙ ИССЛЕДОВАТЕЛЬСКИЙ ЦЕНТР СЕРДЕЧНО-СОСУДИСТОЙ ХИРУРГИИ ИМЕНИ А.Н. БАКУЛЕВА"" МИНИСТЕРСТВА ЗДРАВООХРАНЕНИЯ РОССИЙСКОЙ ФЕДЕРАЦИИ",https://zakupki.gov.ru/epz/organization/view/info.html?organizationId=762438,28041500.0,54,Новосибирская область,2026-04-25T20:07:08.173490
0188300004526000033,https://zakupki.gov.ru/epz/order/notice/ea20/view/common-info.html?regNumber=0188300004526000033,44-ФЗ,44-ФЗ                                    Электронный аукцион,Определение поставщика завершено,Поставка продуктов питания (свинина замороженная),АДМИНИСТРАЦИЯ МУНИЦИПАЛЬНОГО ОКРУГА ПЕВЕК,https://zakupki.gov.ru/epz/organization/view/info.html?reestrNumber=769079,309572.5,54,Новосибирская область,2026-04-25T20:07:11.694760
0357400000226000001,https://zakupki.gov.ru/epz/order/notice/zk20/view/common-info.html?regNumber=0357400000226000001,44-ФЗ,44-ФЗ                                    Запрос котировок в электронной форме,Подача заявок,"Предоставление Арендодателем за обусловленную контрактом плату во временное пользование Арендатору судна с экипажем с предоставлением услуг по его управлению и технической эксплуатации, услуг экипажа судна при проведении промысловых научных рыбохозяйственных исследований на Чудско-Псковском озере в целях выполнения Государственного задания для нужд Псковского филиала ФГБНУ ""ВНИРО""","ПСКОВСКИЙ ФИЛИАЛ ФЕДЕРАЛЬНОГО ГОСУДАРСТВЕННОГО БЮДЖЕТНОГО НАУЧНОГО УЧРЕЖДЕНИЯ ""ВСЕРОССИЙСКИЙ НАУЧНО-ИССЛЕДОВАТЕЛЬСКИЙ ИНСТИТУТ РЫБНОГО ХОЗЯЙСТВА И ОКЕАНОГРАФИИ""",https://zakupki.gov.ru/epz/organization/view/info.html?organizationId=2242185,6900000.0,54,Новосибирская область,2026-04-25T20:07:11.696035
0356200004226000069,https://zakupki.gov.ru/epz/order/notice/ea20/view/common-info.html?regNumber=0356200004226000069,44-ФЗ,44-ФЗ                                    Электронный аукцион,Подача заявок,Пакеты для установки по утилизации медицинских отходов,"ГОСУДАРСТВЕННОЕ БЮДЖЕТНОЕ УЧРЕЖДЕНИЕ ЗДРАВООХРАНЕНИЯ ПЕРМСКОГО КРАЯ ""ПЕРМСКАЯ КРАЕВАЯ КЛИНИЧЕСКАЯ ИНФЕКЦИОННАЯ БОЛЬНИЦА""",https://zakupki.gov.ru/epz/organization/view/info.html?organizationId=619896,163700.0,54,Новосибирская область,2026-04-25T20:07:11.697678
0348500002126000050,https://zakupki.gov.ru/epz/order/notice/ea20/view/common-info.html?regNumber=0348500002126000050,44-ФЗ,44-ФЗ                                    Электронный аукцион,Подача заявок,Поставка расходных материалов для стоматологии на 2026 год (лот 2),"ГОСУДАРСТВЕННОЕ БЮДЖЕТНОЕ УЧРЕЖДЕНИЕ ЗДРАВООХРАНЕНИЯ МОСКОВСКОЙ ОБЛАСТИ ""ЧЕХОВСКАЯ БОЛЬНИЦА""",https://zakupki.gov.ru/epz/organization/view/info.html?organizationId=2247603,900549.15,54,Новосибирская область,2026-04-25T20:07:11.698698
0341300048226000089,https://zakupki.gov.ru/epz/order/notice/ea20/view/common-info.html?regNumber=0341300048226000089,44-ФЗ,44-ФЗ                                    Электронный аукцион,Подача заявок,"Поставка реагентов для автоматического биохимического анализатора DIRUI CS-T240, CS-300B лот 1 для  ОГБУЗ Мантуровская ЦРБ","ОБЛАСТНОЕ ГОСУДАРСТВЕННОЕ БЮДЖЕТНОЕ УЧРЕЖДЕНИЕ ЗДРАВООХРАНЕНИЯ ""МАНТУРОВСКАЯ ЦЕНТРАЛЬНАЯ РАЙОННАЯ БОЛЬНИЦА""",https://zakupki.gov.ru/epz/organization/view/info.html?organizationId=753604,242004.0,54,Новосибирская область,2026-04-25T20:07:11.699603
0360300129926000059,https://zakupki.gov.ru/epz/order/notice/ea20/view/common-info.html?regNumber=0360300129926000059,44-ФЗ,44-ФЗ                                    Электронный аукцион,Определение поставщика завершено,Поставка мяса птицы,"ГОСУДАРСТВЕННОЕ УЧРЕЖДЕНИЕ ЗДРАВООХРАНЕНИЯ САРАТОВСКОЙ ОБЛАСТИ ""КРАСНОПАРТИЗАНСКАЯ РАЙОННАЯ БОЛЬНИЦА""",https://zakupki.gov.ru/epz/organization/view/info.html?organizationId=722066,46252.0,54,Новосибирская область,2026-04-25T20:07:11.700564
0711200020326000018,https://zakupki.gov.ru/epz/order/notice/ea20/view/common-info.html?regNumber=0711200020326000018,44-ФЗ,44-ФЗ                                    Электронный аукцион,Подача заявок,Оказание услуг по организации питания пациентов для ГАУЗ «Госпиталь для ветеранов войн» г.Казани,"ГОСУДАРСТВЕННОЕ АВТОНОМНОЕ УЧРЕЖДЕНИЕ ЗДРАВООХРАНЕНИЯ ""ГОСПИТАЛЬ ДЛЯ ВЕТЕРАНОВ ВОЙН"" Г. КАЗАНИ",https://zakupki.gov.ru/epz/organization/view/info.html?organizationId=1420592,8058240.0,54,Новосибирская область,2026-04-25T20:07:11.701405
0363300122426000013,https://zakupki.gov.ru/epz/order/notice/zk20/view/common-info.html?regNumber=0363300122426000013,44-ФЗ,44-ФЗ                                    Запрос котировок в электронной форме,Подача заявок,Закупка услуг по изготовлению и поставке печатной продукции (открытка),"МУНИЦИПАЛЬНОЕ БЮДЖЕТНОЕ УЧРЕЖДЕНИЕ ""ХОЗЯЙСТВЕННО-ЭКСПЛУАТАЦИОННОЕ УПРАВЛЕНИЕ СМОЛЕНСКОГО РАЙОНА""",https://zakupki.gov.ru/epz/organization/view/info.html?organizationId=1394750,63054.0,54,Новосибирская область,2026-04-25T20:07:11.702926
32615950484,https://zakupki.gov.ru/epz/order/notice/notice223/common-info.html?noticeInfoId=19704262,223-ФЗ,"223-ФЗ                                    Конкурс в электронной форме, участниками которого могут являться только субъекты малого и среднего предпринимательства",Подача заявок,"Поставка оборудования и материалов для пожарной безопасности для нужд Нижегородского филиала ООО ""ЭН+ ТОРГОВЫЙ ДОМ"" во II полугодии 2026 г.","ОБЩЕСТВО С ОГРАНИЧЕННОЙ ОТВЕТСТВЕННОСТЬЮ ""ЭН+ ТОРГОВЫЙ ДОМ""",https://zakupki.gov.ru/epz/organization/view223/info.html?agencyId=20621,1106728.0,54,Новосибирская область,2026-04-25T20:07:11.705040
0332200063926000002,https://zakupki.gov.ru/epz/order/notice/zk20/view/common-info.html?regNumber=0332200063926000002,44-ФЗ,44-ФЗ                                    Запрос котировок в электронной форме,Определение поставщика завершено,"Оказание услуг по методическому сопровождению и технической поддержке системы персонифицированного финансирования дополнительного образования детей в Нижегородской области, поддерживаемой информационным ресурсом «Навигатор дополнительного образования детей в Нижегородской области», в рамках функционирования регионального модельного центра дополнительного образования детей.","ГОСУДАРСТВЕННОЕ БЮДЖЕТНОЕ УЧРЕЖДЕНИЕ ДОПОЛНИТЕЛЬНОГО ОБРАЗОВАНИЯ ""ЦЕНТР РАЗВИТИЯ ТВОРЧЕСТВА ДЕТЕЙ И ЮНОШЕСТВА НИЖЕГОРОДСКОЙ ОБЛАСТИ""",https://zakupki.gov.ru/epz/organization/view/info.html?organizationId=738162,6436000.0,54,Новосибирская область,2026-04-25T20:07:11.706511
32615949956,https://zakupki.gov.ru/epz/order/notice/notice223/common-info.html?noticeInfoId=19703627,223-ФЗ,223-ФЗ                                    Прочие,Работа комиссии,"Трансформаторная подстанция КТПН-ВВ-400/10/0,4","АКЦИОНЕРНОЕ ОБЩЕСТВО ""АКЦИОНЕРНАЯ КОМПАНИЯ ""ЖЕЛЕЗНЫЕ ДОРОГИ ЯКУТИИ""",https://zakupki.gov.ru/epz/organization/view223/info.html?agencyId=7656,1974145.0,54,Новосибирская область,2026-04-25T20:07:15.792819
32615949946,https://zakupki.gov.ru/epz/order/notice/notice223/common-info.html?noticeInfoId=19703637,223-ФЗ,223-ФЗ                                    Прочие,Работа комиссии,монтажные и пуско-наладочные работы на газовой котельной железнодорожной станции,"АКЦИОНЕРНОЕ ОБЩЕСТВО ""АКЦИОНЕРНАЯ КОМПАНИЯ ""ЖЕЛЕЗНЫЕ ДОРОГИ ЯКУТИИ""",https://zakupki.gov.ru/epz/organization/view223/info.html?agencyId=7656,7096000.0,54,Новосибирская область,2026-04-25T20:07:15.794150
0333300018926000066,https://zakupki.gov.ru/epz/order/notice/ezt20/view/common-info.html?regNumber=0333300018926000066,44-ФЗ,"44-ФЗ                                    Закупка, осуществляемая в соответствии с частью 12 статьи 93 Закона № 44-ФЗ",Работа комиссии,Электрокардиограф,"ОБЛАСТНОЕ БЮДЖЕТНОЕ УЧРЕЖДЕНИЕ ЗДРАВООХРАНЕНИЯ ""ИВАНОВСКАЯ КЛИНИЧЕСКАЯ БОЛЬНИЦА ИМЕНИ КУВАЕВЫХ""",https://zakupki.gov.ru/epz/organization/view/info.html?organizationId=675070,396226.66,54,Новосибирская область,2026-04-25T20:07:15.795926
32615951114,https://zakupki.gov.ru/epz/order/notice/notice223/common-info.html?noticeInfoId=19705002,223-ФЗ,"223-ФЗ                                    Аукцион в электронной форме, участниками которого могут являться только субъекты малого и среднего предпринимательства",Подача заявок,Поставка жидкостного хроматографа с выполнением монтажных работ,"АКЦИОНЕРНОЕ ОБЩЕСТВО ""НАУЧНО-ИССЛЕДОВАТЕЛЬСКИЙ ИНСТИТУТ ОРГАНИЧЕСКИХ ПОЛУПРОДУКТОВ И КРАСИТЕЛЕЙ""",https://zakupki.gov.ru/epz/organization/view223/info.html?agencyId=634556,10100300.3,54,Новосибирская область,2026-04-25T20:07:15.797139
0148400000626000012,https://zakupki.gov.ru/epz/order/notice/zk20/view/common-info.html?regNumber=0148400000626000012,44-ФЗ,44-ФЗ                                    Запрос котировок в электронной форме,Подача заявок,Приобретение путевок на санаторно-курортное лечение,АПЕЛЛЯЦИОННЫЙ ВОЕННЫЙ СУД,https://zakupki.gov.ru/epz/organization/view/info.html?organizationId=2246871,254600.0,54,Новосибирская область,2026-04-25T20:07:15.798083
0333300035626000112,https://zakupki.gov.ru/epz/order/notice/ezt20/view/common-info.html?regNumber=0333300035626000112,44-ФЗ,"44-ФЗ                                    Закупка, осуществляемая в соответствии с частью 12 статьи 93 Закона № 44-ФЗ",Определение поставщика завершено,Стенд информационный,"ОБЛАСТНОЕ БЮДЖЕТНОЕ УЧРЕЖДЕНИЕ ЗДРАВООХРАНЕНИЯ ""ГОРОДСКАЯ КЛИНИЧЕСКАЯ БОЛЬНИЦА №3 Г.ИВАНОВА""",https://zakupki.gov.ru/epz/organization/view/info.html?organizationId=695919,120000.0,54,Новосибирская область,2026-04-25T20:07:15.799463
0387100006626000010,https://zakupki.gov.ru/epz/order/notice/ea20/view/common-info.html?regNumber=0387100006626000010,44-ФЗ,44-ФЗ                                    Электронный аукцион,Определение поставщика завершено,Поставка нагнетателя масла,"ФЕДЕРАЛЬНОЕ ГОСУДАРСТВЕННОЕ БЮДЖЕТНОЕ УЧРЕЖДЕНИЕ ""ГОСУДАРСТВЕННЫЙ ПРИРОДНЫЙ ЗАПОВЕДНИК ""МАЛАЯ СОСЬВА"" ИМЕНИ В.В. РАЕВСКОГО""",https://zakupki.gov.ru/epz/organization/view/info.html?organizationId=691030,18000.0,54,Новосибирская область,2026-04-25T20:07:15.800361
32615949403,https://zakupki.gov.ru/epz/order/notice/notice223/common-info.html?noticeInfoId=19702554,223-ФЗ,"223-ФЗ                                    Запрос котировок в электронной форме, участниками которого могут являться только субъекты малого и среднего предпринимательства",Подача заявок,Поставка компьютерной техники,"ФЕДЕРАЛЬНОЕ АВТОНОМНОЕ НАУЧНОЕ УЧРЕЖДЕНИЕ ""ВОСТОЧНЫЙ ЦЕНТР ГОСУДАРСТВЕННОГО ПЛАНИРОВАНИЯ""",https://zakupki.gov.ru/epz/organization/view223/info.html?agencyId=139283,941318.67,54,Новосибирская область,2026-04-25T20:07:15.801199
32615946171,https://zakupki.gov.ru/epz/order/notice/notice223/common-info.html?noticeInfoId=19704985,223-ФЗ,"223-ФЗ                                    Запрос котировок в электронной форме, участниками которого могут являться только субъекты малого и среднего предпринимательства",Подача заявок,Поставка бензотриммеров и расходных материалов к ним,"ГОСУДАРСТВЕННОЕ БЮДЖЕТНОЕ УЧРЕЖДЕНИЕ ЗДРАВООХРАНЕНИЯ ""СПЕЦИАЛИЗИРОВАННАЯ ПСИХИАТРИЧЕСКАЯ БОЛЬНИЦА № 6"" МИНИСТЕРСТВА ЗДРАВООХРАНЕНИЯ КРАСНОДАРСКОГО КРАЯ",https://zakupki.gov.ru/epz/organization/view223/info.html?agencyId=317332,523924.98,54,Новосибирская область,2026-04-25T20:07:15.803202
0387100006626000009,https://zakupki.gov.ru/epz/order/notice/ea20/view/common-info.html?regNumber=0387100006626000009,44-ФЗ,44-ФЗ                                    Электронный аукцион,Определение поставщика завершено,Поставка гаражного оборудования,"ФЕДЕРАЛЬНОЕ ГОСУДАРСТВЕННОЕ БЮДЖЕТНОЕ УЧРЕЖДЕНИЕ ""ГОСУДАРСТВЕННЫЙ ПРИРОДНЫЙ ЗАПОВЕДНИК ""МАЛАЯ СОСЬВА"" ИМЕНИ В.В. РАЕВСКОГО""",https://zakupki.gov.ru/epz/organization/view/info.html?organizationId=691030,69500.0,54,Новосибирская область,2026-04-25T20:07:15.804743
0387100006626000008,https://zakupki.gov.ru/epz/order/notice/ea20/view/common-info.html?regNumber=0387100006626000008,44-ФЗ,44-ФЗ                                    Электронный аукцион,Определение поставщика завершено,Поставка соли глыбовой,"ФЕДЕРАЛЬНОЕ ГОСУДАРСТВЕННОЕ БЮДЖЕТНОЕ УЧРЕЖДЕНИЕ ""ГОСУДАРСТВЕННЫЙ ПРИРОДНЫЙ ЗАПОВЕДНИК ""МАЛАЯ СОСЬВА"" ИМЕНИ В.В. РАЕВСКОГО""",https://zakupki.gov.ru/epz/organization/view/info.html?organizationId=691030,179184.0,54,Новосибирская область,2026-04-25T20:07:19.980635
0352300152726000057,https://zakupki.gov.ru/epz/order/notice/ezt20/view/common-info.html?regNumber=0352300152726000057,44-ФЗ,"44-ФЗ                                    Закупка, осуществляемая в соответствии с частью 12 статьи 93 Закона № 44-ФЗ",Работа комиссии,"Эритроциты для скрининга антител ИВД, набор, реакция агглютинации","БЮДЖЕТНОЕ УЧРЕЖДЕНИЕ ЗДРАВООХРАНЕНИЯ ОМСКОЙ ОБЛАСТИ ""ОДЕССКАЯ ЦЕНТРАЛЬНАЯ РАЙОННАЯ БОЛЬНИЦА""",https://zakupki.gov.ru/epz/organization/view/info.html?organizationId=755801,7335.34,54,Новосибирская область,2026-04-25T20:07:19.982176
0332200003926000003,https://zakupki.gov.ru/epz/order/notice/ea20/view/common-info.html?regNumber=0332200003926000003,44-ФЗ,44-ФЗ                                    Электронный аукцион,Определение поставщика завершено,Поставка бумаги для офисной техники,"ГОСУДАРСТВЕННОЕ БЮДЖЕТНОЕ  УЧРЕЖДЕНИЕ ""КОМПЛЕКСНЫЙ ЦЕНТР СОЦИАЛЬНОГО ОБСЛУЖИВАНИЯ НАСЕЛЕНИЯ ""МЫЗА"" ПРИОКСКОГО РАЙОНА ГОРОДА НИЖНЕГО НОВГОРОДА""",https://zakupki.gov.ru/epz/organization/view/info.html?organizationId=617393,128000.0,54,Новосибирская область,2026-04-25T20:07:19.984060
0348200063726000428,https://zakupki.gov.ru/epz/order/notice/ea20/view/common-info.html?regNumber=0348200063726000428,44-ФЗ,44-ФЗ                                    Электронный аукцион,Определение поставщика завершено,Поставка лекарственных препаратов в 2026 году (лот 121),"ГОСУДАРСТВЕННОЕ БЮДЖЕТНОЕ УЧРЕЖДЕНИЕ ЗДРАВООХРАНЕНИЯ МОСКОВСКОЙ ОБЛАСТИ  ""ДЕТСКИЙ НАУЧНО-КЛИНИЧЕСКИЙ ЦЕНТР ИМЕНИ Л.М. РОШАЛЯ""",https://zakupki.gov.ru/epz/organization/view/info.html?organizationId=754186,205123.82,54,Новосибирская область,2026-04-25T20:07:19.985628
